PT,AU,BA,BE,GP,AF,BF,CA,TI,SO,SE,BS,LA,DT,CT,CY,CL,SP,HO,DE,ID,AB,C1,RP,EM,RI,OI,FU,FX,CR,NR,TC,Z9,U1,U2,PU,PI,PA,SN,EI,BN,J9,JI,PD,PY,VL,IS,PN,SU,SI,MA,BP,EP,AR,DI,D2,EA,PG,WC,SC,GA,UT,PM,OA,HC,HP,DAJ,"HEPPER, CM; SEN, R; AZCONAGUILAR, C; GRACE, C",,,,"HEPPER, CM; SEN, R; AZCONAGUILAR, C; GRACE, C",,,"VARIATION IN CERTAIN ISOZYMES AMONGST DIFFERENT GEOGRAPHICAL ISOLATES OF THE VESICULAR ARBUSCULAR MYCORRHIZAL FUNGI GLOMUS-CLARUM, GLOMUS-MONOSPORUM AND GLOMUS-MOSSEAE",SOIL BIOLOGY & BIOCHEMISTRY,,,English,Article,,,,,,,,,,"HEPPER, CM (reprint author), ROTHAMSTED EXPTL STN,DEPT SOIL MICROBIOL,HARPENDEN AL5 2JQ,HERTS,ENGLAND.",,"Sen, Robin/G-3263-2011; Azcon, Concepcion/H-5873-2015","Sen, Robin/0000-0002-1914-2178; Azcon, Concepcion/0000-0003-3041-8566",,,,34,43,43,0,0,PERGAMON-ELSEVIER SCIENCE LTD,OXFORD,"THE BOULEVARD, LANGFORD LANE, KIDLINGTON, OXFORD, ENGLAND OX5 1GB",0038-0717,,,SOIL BIOL BIOCHEM,Soil Biol. Biochem.,,1988,20,1,,,,,51,59,,10.1016/0038-0717(88)90126-5,,,9,Soil Science,Agriculture,L3042,WOS:A1988L304200009,,,,,10/31/19J,"MILLER, MS; PEPPER, IL",,,,"MILLER, MS; PEPPER, IL",,,PHYSIOLOGICAL AND BIOCHEMICAL CHARACTERISTICS OF A FAST-GROWING STRAIN OF LUPIN RHIZOBIA ISOLATED FROM THE SONORAN DESERT,SOIL BIOLOGY & BIOCHEMISTRY,,,English,Article,,,,,,,,,,"MILLER, MS (reprint author), UNIV ARIZONA,DEPT SOIL & WATER SCI,429 SHANTZ BLDG,TUCSON,AZ 85721, USA.",,,,,,,15,5,5,0,2,PERGAMON-ELSEVIER SCIENCE LTD,OXFORD,"THE BOULEVARD, LANGFORD LANE, KIDLINGTON, OXFORD, ENGLAND OX5 1GB",0038-0717,,,SOIL BIOL BIOCHEM,Soil Biol. Biochem.,,1988,20,3,,,,,319,322,,10.1016/0038-0717(88)90011-9,,,4,Soil Science,Agriculture,P2410,WOS:A1988P241000010,,,,,10/31/19J,"MILLER, MS; PEPPER, IL",,,,"MILLER, MS; PEPPER, IL",,,SURVIVAL OF A FAST-GROWING STRAIN OF LUPIN RHIZOBIA IN SONORAN DESERT SOILS,SOIL BIOLOGY & BIOCHEMISTRY,,,English,Article,,,,,,,,,,"MILLER, MS (reprint author), UNIV ARIZONA,DEPT SOIL & WATER SCI,429 SHANTZ BLDG,TUCSON,AZ 85721, USA.",,,,,,,21,19,19,0,3,PERGAMON-ELSEVIER SCIENCE LTD,OXFORD,"THE BOULEVARD, LANGFORD LANE, KIDLINGTON, OXFORD, ENGLAND OX5 1GB",0038-0717,,,SOIL BIOL BIOCHEM,Soil Biol. Biochem.,,1988,20,3,,,,,323,327,,10.1016/0038-0717(88)90012-0,,,5,Soil Science,Agriculture,P2410,WOS:A1988P241000011,,,,,10/31/19J,"WILLIAMS, WM; HOH, CH; LENZ, F; BROUGHTON, WJ",,,,"WILLIAMS, WM; HOH, CH; LENZ, F; BROUGHTON, WJ",,,RHIZOBIA IN TROPICAL LEGUMES - ENVIRONMENTAL-FACTORS AND THE REDUCTION OF NITROGEN,SOIL BIOLOGY & BIOCHEMISTRY,,,English,Article,,,,,,,,,"SALISBURY COLL ADV EDUC,DEPT BIOL,SALISBURY E,SA 5109,AUSTRALIA; UNIV WESTERN AUSTRALIA,DEPT BIOCHEM,NEDLANDS,WA 6009,AUSTRALIA; UNIV BONN,INST OBSTBAU & GEMUSEBAU,D-5300 BONN,FED REP GER; UNIV GENEVE,BIOL MOLEC PLANTES SUPER LAB,CH-1292 CHAMBESY,SWITZERLAND","WILLIAMS, WM (reprint author), UNIV MALAYA,JABATAN GENET & BIOL SEL,KUALA LUMPUR 2211,MALAYSIA.",,,,,,,30,5,5,0,2,PERGAMON-ELSEVIER SCIENCE LTD,OXFORD,"THE BOULEVARD, LANGFORD LANE, KIDLINGTON, OXFORD, ENGLAND OX5 1GB",0038-0717,,,SOIL BIOL BIOCHEM,Soil Biol. Biochem.,,1988,20,5,,,,,667,675,,10.1016/0038-0717(88)90151-4,,,9,Soil Science,Agriculture,Q8939,WOS:A1988Q893900012,,,,,10/31/19J,"WONG, CH; PATCHAMUTHU, R; MEYER, H; PANKHURST, CE; BROUGHTON, WJ",,,,"WONG, CH; PATCHAMUTHU, R; MEYER, H; PANKHURST, CE; BROUGHTON, WJ",,,RHIZOBIA IN TROPICAL LEGUMES - INEFFECTIVE NODULATION OF ARACHIS-HYPOGAEA L BY FAST-GROWING STRAINS,SOIL BIOLOGY & BIOCHEMISTRY,,,English,Article,,,,,,,,,"MAX PLANCK INST ZUCHTUNGSFORSCH,D-5000 COLOGNE 30,FED REP GER; CSIRO,DIV SOILS,ADELAIDE,SA 5064,AUSTRALIA; UNIV GENEVE,BIOL MOLEC PLANTES SUPER LAB,CH-1292 CHAMBESY,SWITZERLAND","WONG, CH (reprint author), UNIV SAINS MALAYSIA,PUSAT PENGAJIAN SAINS KAJIHAYAT,PULAU PINANG,MALAYSIA.",,,,,,,22,9,9,0,0,PERGAMON-ELSEVIER SCIENCE LTD,OXFORD,"THE BOULEVARD, LANGFORD LANE, KIDLINGTON, OXFORD, ENGLAND OX5 1GB",0038-0717,,,SOIL BIOL BIOCHEM,Soil Biol. Biochem.,,1988,20,5,,,,,677,681,,10.1016/0038-0717(88)90152-6,,,5,Soil Science,Agriculture,Q8939,WOS:A1988Q893900013,,,,,10/31/19J,"CHUCHOU, M; GRACE, LJ",,,,"CHUCHOU, M; GRACE, LJ",,,MYCORRHIZAL FUNGI OF RADIATA PINE IN DIFFERENT FORESTS OF THE NORTH AND SOUTH ISLANDS IN NEW-ZEALAND,SOIL BIOLOGY & BIOCHEMISTRY,,,English,Article,,,,,,,,,,"CHUCHOU, M (reprint author), FOREST RES INST,ROTORUA,NEW ZEALAND.",,,,,,,11,25,30,0,4,PERGAMON-ELSEVIER SCIENCE LTD,OXFORD,"THE BOULEVARD, LANGFORD LANE, KIDLINGTON, OXFORD, ENGLAND OX5 1GB",0038-0717,,,SOIL BIOL BIOCHEM,Soil Biol. Biochem.,,1988,20,6,,,,,883,886,,10.1016/0038-0717(88)90098-3,,,4,Soil Science,Agriculture,R6909,WOS:A1988R690900017,,,,,10/31/19J,"BOYLE, CD; ROBERTSON, WJ; SALONIUS, PO",,,,"BOYLE, CD; ROBERTSON, WJ; SALONIUS, PO",,,USE OF MYCELIAL SLURRIES OF MYCORRHIZAL FUNGI AS INOCULUM FOR COMMERCIAL TREE SEEDLING NURSERIES,CANADIAN JOURNAL OF FOREST RESEARCH-REVUE CANADIENNE DE RECHERCHE FORESTIERE,,,English,Article,,,,,,,,,"CANADIAN FOREST SERV,MARITIME FORESTRY CTR,FREDERICTON E3B 5P7,NB,CANADA","BOYLE, CD (reprint author), NOVA SCOTIA RES FDN CORP,DARTMOUTH B2Y 3Z7,NS,CANADA.",,,,,,,16,19,20,0,2,NATL RESEARCH COUNCIL CANADA,OTTAWA,"RESEARCH JOURNALS, MONTREAL RD, OTTAWA ON K1A 0R6, CANADA",0045-5067,,,CAN J FOREST RES,Can. J. For. Res.-Rev. Can. Rech. For.,DEC,1987,17,12,,,,,1480,1486,,10.1139/x87-230,,,7,Forestry,Forestry,M5548,WOS:A1987M554800002,,,,,10/31/19J,"Haug, I; Oberwinkler, F",,,,"Haug, Ingeborg; Oberwinkler, Franz",,,Some distinctive types of spruce mycorrhizae,TREES-STRUCTURE AND FUNCTION,,,English,Article,,,,,,Picea abies; Mycorrhizal types; Hyphal mantle structure,,"For examination and recognition of mycorrhizal types, the structure of the hyphal mantle in tangential longitudinal sections has proved to be a valuable feature for investigation. Features of hyphal mantle structure have been used for establishing an identification key. The colour of the hyphal mantle is a helpful additional characteristic, but is not useful as a diagnostic feature because of variations in advanced age and under varying environmental conditions. Rhizomorphs yield good taxonomic characteristics. The Hartig net was uniform for all types examined. When differences were observed they had to be interpreted as different stages of development. Ultrastructural examination revealed further features of mycorrhizal types: namely the shape of septal pores, presence and structure of matrix material in the region of the hyphal mantle and characteristic deposits on cell walls of the hyphae. The ten types presented can be distinguished without any ultrastructural features. As far as the fungal partners involved are concerned, basidiomycetes are clearly dominant. For the first time two basidiomycetes with continuous parenthesomes of their dolipores were found to form ectomycorrhizae. Classification of these fungi with the heterobasidiomycetes is discussed.","[Haug, Ingeborg; Oberwinkler, Franz] Univ Tubingen, Lehrstuhl Spezielle Bot, D-7400 Tubingen, Germany","Haug, I (reprint author), Univ Tubingen, Lehrstuhl Spezielle Bot, Morgenstelle 1, D-7400 Tubingen, Germany.",,,,Bundesministerium fur Forschung und Technologie [Forderkennzeichen 373292]; Projekt Europaisches Forschungszentrum Karlsruhe,The authors are indebted to the Bundesministerium fur Forschung und Technologie (Forderkennzeichen 373292) and the Projekt Europaisches Forschungszentrum Karlsruhe for grants during the investigation.,,25,29,31,0,0,SPRINGER,NEW YORK,"233 SPRING ST, NEW YORK, NY 10013 USA",0931-1890,,,TREES-STRUCT FUNCT,Trees-Struct. Funct.,DEC,1987,1,3,,,,,172,188,,,,,17,Forestry,Forestry,V10CN,WOS:000207442200006,,,,,10/31/19J,"Kottke, I; Guttenberger, M; Hampp, R; Oberwinkler, F",,,,"Kottke, I.; Guttenberger, M.; Hampp, R.; Oberwinkler, F.",,,An in vitro method for establishing mycorrhizae on coniferous tree seedlings,TREES-STRUCTURE AND FUNCTION,,,English,Article,,,,,,Basidiomycetes; Coniferous trees; Ectomycorrhiza; In vitro culture; Symbiosis,,"A method for in vitro synthesis of mycorrhizae on coniferous tree seedlings is described. Tree seedlings (Larix decidua Mill., Picea abies (L.) Karst. and Pinus sylvestris L.) and fungi (Amanita muscaria (L. ex Fr.) Hooker, Piloderma croceum Erikss. et Hjorst., Pisolithus tinctorius (Pers.) Coker et Couch. and Suillus grevillei (Klotzsch) Singer were maintained under sterile conditions in petri dishes. Typical ectomycorrhizae were established within 2-3 weeks after inoculation and within 2 months after germination of seedlings. Eventually a high percentage of mycorrhizal root tips was obtained.","[Kottke, I.; Guttenberger, M.; Hampp, R.; Oberwinkler, F.] Univ Tubingen, Inst Biol 1, D-7400 Tubingen, Germany","Kottke, I (reprint author), Univ Tubingen, Inst Biol 1, D-7400 Tubingen, Germany.",,,,"Deutsche ForschungsgemeinschaftGerman Research Foundation (DFG); Projekt Europaisches Forschungszentrum, Karlsruhe","The authors are indebted to Professor W. H. Outlaw, Jr., for correcting the English. The skilful technical assistance of O. Ebinger-Gabele is gratefully appreciated. This work was supported by grants from the Deutsche Forschungsgemeinschaft (R. H.) and the Projekt Europaisches Forschungszentrum, Karlsruhe (I. K.).",,6,93,118,0,26,SPRINGER,NEW YORK,"233 SPRING ST, NEW YORK, NY 10013 USA",0931-1890,,,TREES-STRUCT FUNCT,Trees-Struct. Funct.,DEC,1987,1,3,,,,,191,194,,,,,4,Forestry,Forestry,V10CN,WOS:000207442200008,,,,,10/31/19J,"KENNEDY, C; MERRICK, M; HOLTEL, A; LACCARINO, M; GUIDA, M",,,,"KENNEDY, C; MERRICK, M; HOLTEL, A; LACCARINO, M; GUIDA, M",,,"RELATIONSHIPS OF NIF, NTR AND GLN GENES IN FREE-LIVING NITROGEN-FIXING BACTERIA TO THOSE IN RHIZOBIA",HEREDITY,,,English,Meeting Abstract,,,,,,,,,"CNRS,INT INST GENET & BIOPHYS,I-80125 NAPLES,ITALY; UNIV SUSSEX,AFRC,NITROGEN FIXAT UNIT,BRIGHTON BN1 9RQ,E SUSSEX,ENGLAND",,,,,,,,0,0,0,0,0,BLACKWELL SCIENCE LTD,OXFORD,"OSNEY MEAD, OXFORD, OXON, ENGLAND OX2 0EL",0018-067X,,,HEREDITY,Heredity,OCT,1987,59,,2,,,,310,310,,,,,1,Ecology; Evolutionary Biology; Genetics & Heredity,Environmental Sciences & Ecology; Evolutionary Biology; Genetics & Heredity,K3157,WOS:A1987K315700027,,,,,10/31/19J,"MILLER, P",,,,"MILLER, P",,,"THE NATURE OF THE BEAST - ARE ANIMALS MORAL - CLARK,SRL",ENVIRONMENTAL ETHICS,,,English,Book Review,,,,,,,,,,"MILLER, P (reprint author), UNIV WINNIPEG,DEPT PHILOSOPHY,515 PORTAGE AVE,WINNIPEG R3B 2E9,MANITOBA,CANADA.",,,,,,,1,0,0,0,0,ENVIRONMENTAL PHILOSOPHY INC,DENTON,"UNIV NORTH TEXAS, DEPT PHILOSOPHY, PO BOX 13496, DENTON, TX 76203-3496",0163-4275,,,ENVIRON ETHICS,Environ. Ethics,FAL,1987,9,3,,,,,277,279,,10.5840/enviroethics19879310,,,3,Ethics; Environmental Studies,Social Sciences - Other Topics; Environmental Sciences & Ecology,K3486,WOS:A1987K348600008,,,,,10/31/19J,"VOGT, KA; VOGT, DJ; MOORE, EE; FATUGA, BA; REDLIN, MR; EDMONDS, RL",,,,"VOGT, KA; VOGT, DJ; MOORE, EE; FATUGA, BA; REDLIN, MR; EDMONDS, RL",,,CONIFER AND ANGIOSPERM FINE-ROOT BIOMASS IN RELATION TO STAND AGE AND SITE PRODUCTIVITY IN DOUGLAS-FIR FORESTS,JOURNAL OF ECOLOGY,,,English,Article,,,,,,,,,,"VOGT, KA (reprint author), UNIV WASHINGTON,COLL FOREST RESOURCES,AR-10,SEATTLE,WA 98195, USA.",,,,,,,62,126,132,0,22,BLACKWELL SCIENCE LTD,OXFORD,"OSNEY MEAD, OXFORD, OXON, ENGLAND OX2 0EL",0022-0477,,,J ECOL,J. Ecol.,SEP,1987,75,3,,,,,857,870,,10.2307/2260210,,,14,Plant Sciences; Ecology,Plant Sciences; Environmental Sciences & Ecology,J9921,WOS:A1987J992100020,,,,,10/31/19J,"HUNT, R; NICHOLLS, AO; FATHY, SA",,,,"HUNT, R; NICHOLLS, AO; FATHY, SA",,,GROWTH AND ROOT-SHOOT PARTITIONING IN 18 BRITISH GRASSES,OIKOS,,,English,Article,,,,,,,,,"CSIRO,DIV WATER & LAND RESOURCES,CANBERRA,ACT 2601,AUSTRALIA; UNIV CAIRO,FAC SCI,DEPT BOT,GIZA,EGYPT","HUNT, R (reprint author), UNIV SHEFFIELD,DEPT BOT,SHEFFIELD S10 2TN,S YORKSHIRE,ENGLAND.",,,,,,,11,31,31,0,8,MUNKSGAARD INT PUBL LTD,COPENHAGEN,"35 NORRE SOGADE, PO BOX 2148, DK-1016 COPENHAGEN, DENMARK",0030-1299,,,OIKOS,Oikos,SEP,1987,50,1,,,,,53,59,,10.2307/3565401,,,7,Ecology,Environmental Sciences & Ecology,K0948,WOS:A1987K094800007,,,,,10/31/19J,"SANTANTONIO, D; GRACE, JC",,,,"SANTANTONIO, D; GRACE, JC",,,ESTIMATING FINE-ROOT PRODUCTION AND TURNOVER FROM BIOMASS AND DECOMPOSITION DATA - A COMPARTMENT FLOW MODEL,CANADIAN JOURNAL OF FOREST RESEARCH-REVUE CANADIENNE DE RECHERCHE FORESTIERE,,,English,Article,,,,,,,,,"FOREST RES INST,ROTORUA,NEW ZEALAND",,,,,,,,28,141,166,1,30,NATL RESEARCH COUNCIL CANADA,OTTAWA,"RESEARCH JOURNALS, MONTREAL RD, OTTAWA ON K1A 0R6, CANADA",0045-5067,,,CAN J FOREST RES,Can. J. For. Res.-Rev. Can. Rech. For.,AUG,1987,17,8,,,,,900,908,,10.1139/x87-141,,,9,Forestry,Forestry,K3287,WOS:A1987K328700021,,,,,10/31/19J,"KURZ, WA; KIMMINS, JP",,,,"KURZ, WA; KIMMINS, JP",,,ANALYSIS OF SOME SOURCES OF ERROR IN METHODS USED TO DETERMINE FINE ROOT PRODUCTION IN FOREST ECOSYSTEMS - A SIMULATION APPROACH,CANADIAN JOURNAL OF FOREST RESEARCH-REVUE CANADIENNE DE RECHERCHE FORESTIERE,,,English,Article,,,,,,,,,,"KURZ, WA (reprint author), UNIV BRITISH COLUMBIA,FAC FORESTRY,2357 MAIN MALL,VANCOUVER V6T 1W5,BC,CANADA.",,,,,,,8,82,93,0,7,NATL RESEARCH COUNCIL CANADA,OTTAWA,"RESEARCH JOURNALS, MONTREAL RD, OTTAWA ON K1A 0R6, CANADA",0045-5067,,,CAN J FOREST RES,Can. J. For. Res.-Rev. Can. Rech. For.,AUG,1987,17,8,,,,,909,912,,10.1139/x87-142,,,4,Forestry,Forestry,K3287,WOS:A1987K328700022,,,,,10/31/19J,"SANTANTONIO, D; SANTANTONIO, E",,,,"SANTANTONIO, D; SANTANTONIO, E",,,EFFECT OF THINNING ON PRODUCTION AND MORTALITY OF FINE ROOTS IN A PINUS-RADIATA PLANTATION ON A FERTILE SITE IN NEW-ZEALAND,CANADIAN JOURNAL OF FOREST RESEARCH-REVUE CANADIENNE DE RECHERCHE FORESTIERE,,,English,Article,,,,,,,,,"FOREST RES INST,ROTORUA,NEW ZEALAND",,,,,,,,37,61,64,0,6,NATL RESEARCH COUNCIL CANADA,OTTAWA,"RESEARCH JOURNALS, MONTREAL RD, OTTAWA ON K1A 0R6, CANADA",0045-5067,,,CAN J FOREST RES,Can. J. For. Res.-Rev. Can. Rech. For.,AUG,1987,17,8,,,,,919,928,,10.1139/x87-144,,,10,Forestry,Forestry,K3287,WOS:A1987K328700024,,,,,10/31/19J,"PERRY, DA; MOLINA, R; AMARANTHUS, MP",,,,"PERRY, DA; MOLINA, R; AMARANTHUS, MP",,,"MYCORRHIZAE, MYCORRHIZOSPHERES, AND REFORESTATION - CURRENT KNOWLEDGE AND RESEARCH NEEDS",CANADIAN JOURNAL OF FOREST RESEARCH-REVUE CANADIENNE DE RECHERCHE FORESTIERE,,,English,Article,,,,,,,,,"US FOREST SERV,PACIFIC NW RES STN,CORVALLIS,OR 97331","PERRY, DA (reprint author), OREGON STATE UNIV,COLL FORESTRY,DEPT FOREST SCI,CORVALLIS,OR 97331, USA.",,,,,,,119,194,202,2,28,NATL RESEARCH COUNCIL CANADA,OTTAWA,"RESEARCH JOURNALS, MONTREAL RD, OTTAWA ON K1A 0R6, CANADA",0045-5067,,,CAN J FOREST RES,Can. J. For. Res.-Rev. Can. Rech. For.,AUG,1987,17,8,,,,,929,940,,10.1139/x87-145,,,12,Forestry,Forestry,K3287,WOS:A1987K328700025,,,,,10/31/19J,"SIMMONS, GL; POPE, PE",,,,"SIMMONS, GL; POPE, PE",,,INFLUENCE OF SOIL COMPACTION AND VESICULAR ARBUSCULAR MYCORRHIZAE ON ROOT-GROWTH OF YELLOW POPLAR AND SWEET GUM SEEDLINGS,CANADIAN JOURNAL OF FOREST RESEARCH-REVUE CANADIENNE DE RECHERCHE FORESTIERE,,,English,Article,,,,,,,,,,"SIMMONS, GL (reprint author), PURDUE UNIV,DEPT FORESTRY,W LAFAYETTE,IN 47907, USA.",,,,,,,25,17,17,0,6,NATL RESEARCH COUNCIL CANADA,OTTAWA,"RESEARCH JOURNALS, MONTREAL RD, OTTAWA ON K1A 0R6, CANADA",0045-5067,,,CAN J FOREST RES,Can. J. For. Res.-Rev. Can. Rech. For.,AUG,1987,17,8,,,,,970,975,,10.1139/x87-151,,,6,Forestry,Forestry,K3287,WOS:A1987K328700031,,,,,10/31/19J,"SCHMITT, U; LIESE, W",,,,"SCHMITT, U; LIESE, W",,,ON THE ULTRASTRUCTURE OF MERISTEMATIC TISSUE IN FINE ROOTS OF NORWAY SPRUCE (PICEA-ABIES [L] KARST) FROM FOREST DECLINE AREAS,EUROPEAN JOURNAL OF FOREST PATHOLOGY,,,German,Article,,,,,,,,,,"SCHMITT, U (reprint author), UNIV HAMBURG,BUNDESFORSCHUNGSANSTALT FORST & HOLZWIRTSCH,INST HOLZBIOL & HOLZSCHUTZ,D-2050 HAMBURG 80,FED REP GER.",,,,,,,21,2,2,0,0,BLACKWELL WISSENSCHAFTS-VERLAG GMBH,BERLIN,"KURFURSTENDAMM 57, D-10707 BERLIN, GERMANY",0300-1237,,,EUR J FOREST PATHOL,Eur. J. Forest Pathol.,AUG,1987,17,5-Apr,,,,,292,297,,,,,6,Forestry,Forestry,J8128,WOS:A1987J812800013,,,,,10/31/19J,"PORTER, WM; ROBSON, AD; ABBOTT, LK",,,,"PORTER, WM; ROBSON, AD; ABBOTT, LK",,,FIELD SURVEY OF THE DISTRIBUTION OF VESICULAR ARBUSCULAR MYCORRHIZAL FUNGI IN RELATION TO SOIL-PH,JOURNAL OF APPLIED ECOLOGY,,,English,Article,,,,,,,,,"UNIV WESTERN AUSTRALIA,SCH AGR SOIL SCI,NEDLANDS,WA 6009,AUSTRALIA",,,"Abbott, Lynette K/F-7489-2011","Abbott, Lynette K/0000-0001-8586-7858",,,,10,94,108,4,31,BLACKWELL SCIENCE LTD,OXFORD,"OSNEY MEAD, OXFORD, OXON, ENGLAND OX2 0EL",0021-8901,,,J APPL ECOL,J. Appl. Ecol.,AUG,1987,24,2,,,,,659,662,,10.2307/2403900,,,4,Biodiversity Conservation; Ecology,Biodiversity & Conservation; Environmental Sciences & Ecology,J6778,WOS:A1987J677800022,,,,,10/31/19J,"PORTER, WM; ROBSON, AD; ABBOTT, LK",,,,"PORTER, WM; ROBSON, AD; ABBOTT, LK",,,FACTORS CONTROLLING THE DISTRIBUTION OF VESICULAR ARBUSCULAR MYCORRHIZAL FUNGI IN RELATION TO SOIL-PH,JOURNAL OF APPLIED ECOLOGY,,,English,Article,,,,,,,,,"UNIV WESTERN AUSTRALIA,SCH AGR SOIL SCI,NEDLANDS,WA 6009,AUSTRALIA",,,"Abbott, Lynette K/F-7489-2011","Abbott, Lynette K/0000-0001-8586-7858",,,,19,39,45,0,9,BLACKWELL SCIENCE LTD,OXFORD,"OSNEY MEAD, OXFORD, OXON, ENGLAND OX2 0EL",0021-8901,,,J APPL ECOL,J. Appl. Ecol.,AUG,1987,24,2,,,,,663,672,,10.2307/2403901,,,10,Biodiversity Conservation; Ecology,Biodiversity & Conservation; Environmental Sciences & Ecology,J6778,WOS:A1987J677800023,,,,,10/31/19J,"HO, I",,,,"HO, I",,,VESICULAR-ARBUSCULAR MYCORRHIZAE OF HALOPHYTIC GRASSES IN THE ALVORD DESERT OF OREGON,NORTHWEST SCIENCE,,,English,Article,,,,,,,,,,"HO, I (reprint author), US FOREST SERV,PACIFIC NW RES STN,FORESTRY SCI LAB,3200 JEFFERSON WAY,CORVALLIS,OR 97331, USA.",,,,,,,0,27,29,1,2,WASHINGTON STATE UNIV,PULLMAN,"PO BOX 645910, PULLMAN, WA 99164-5910",0029-344X,,,NORTHWEST SCI,Northwest Sci.,AUG,1987,61,3,,,,,148,151,,,,,4,Ecology,Environmental Sciences & Ecology,K3292,WOS:A1987K329200002,,,,,10/31/19J,"MOREL, JL; MENCH, M; GUCKERT, A",,,,"MOREL, JL; MENCH, M; GUCKERT, A",,,HEAVY-METAL DYNAMICS IN THE RHIZOSPHERE - ROLE OF ROOT EXUDATES,REVUE D ECOLOGIE ET DE BIOLOGIE DU SOL,,,French,Article,,,,,,,,,,"MOREL, JL (reprint author), ECOLE NATL SUPER AGRON & IND ALIMENTAIRES,INST NATL POLYTECH LORRAINE,INRA,2 AVE FORET HAYE,F-54500 VANDOEUVRE,FRANCE.",,"Morel, Jean Louis/I-7560-2012","Morel, Jean Louis/0000-0002-5720-1482",,,,16,8,8,0,3,GAUTHIER-VILLARS,PARIS,"S P E S-JOURNAL DEPT, 120 BD ST GERMAIN, F-75006 PARIS, FRANCE",0035-1822,,,REV ECOL BIOL SOL,,JUL,1987,24,3,,,,,485,492,,,,,8,Ecology; Soil Science,Environmental Sciences & Ecology; Agriculture,N2378,WOS:A1987N237800021,,,,,10/31/19J,"LAST, FT; DIGHTON, J; MASON, PA",,,,"LAST, FT; DIGHTON, J; MASON, PA",,,SUCCESSIONS OF SHEATHING MYCORRHIZAL FUNGI,TRENDS IN ECOLOGY & EVOLUTION,,,English,Review,,,,,,,,,,"LAST, FT (reprint author), UNIV NEWCASTLE UPON TYNE,DEPT SOIL SCI,NEWCASTLE TYNE NE1 7RU,TYNE & WEAR,ENGLAND.",,,,,,,0,135,140,4,32,ELSEVIER SCI LTD,OXFORD,"THE BOULEVARD, LANGFORD LANE, KIDLINGTON, OXFORD, OXON, ENGLAND OX5 1GB",0169-5347,,,TRENDS ECOL EVOL,Trends Ecol. Evol.,JUN,1987,2,6,,,,,157,161,,10.1016/0169-5347(87)90066-8,,,5,Ecology; Evolutionary Biology; Genetics & Heredity,Environmental Sciences & Ecology; Evolutionary Biology; Genetics & Heredity,H9130,WOS:A1987H913000006,21227840,,,,10/31/19J,"MEYER, FH",,,,"MEYER, FH",,,"THE RAMIFICATION INDEX, AN INDICATOR FOR DAMAGE TO THE FINE-ROOT SYSTEM OF DECLINING FORESTS",FORSTWISSENSCHAFTLICHES CENTRALBLATT,,,German,Article,,,,,,,,,,"MEYER, FH (reprint author), INST LANDSCHAFTSPFLEGE & NAT SCHUTZ,HERRENHAUSER STR 2,D-3000 HANNOVER 21,FED REP GER.",,,,,,,0,19,19,0,1,BLACKWELL WISSENSCHAFTS-VERLAG GMBH,BERLIN,"KURFURSTENDAMM 57, D-10707 BERLIN, GERMANY",0015-8003,,,FORSTWISS CENTRALBL,Forstwiss. Cent.bl.,MAY,1987,106,2,,,,,84,92,,10.1007/BF02741137,,,9,Forestry,Forestry,H5666,WOS:A1987H566600004,,,,,10/31/19J,"WAALAND, ME; ALLEN, EB",,,,"WAALAND, ME; ALLEN, EB",,,RELATIONSHIPS BETWEEN VA MYCORRHIZAL FUNGI AND PLANT COVER FOLLOWING SURFACE MINING IN WYOMING,JOURNAL OF RANGE MANAGEMENT,,,English,Article,,,,,,,,,"UTAH STATE UNIV,CTR ECOL,LOGAN,UT 84322","WAALAND, ME (reprint author), UTAH STATE UNIV,DEPT RANGE SCI,LOGAN,UT 84322, USA.",,,,,,,24,36,37,0,7,SOC RANGE MANAGEMENT,DENVER,"1839 YORK ST, DENVER, CO 80206",0022-409X,,,J RANGE MANAGE,J. Range Manage.,MAY,1987,40,3,,,,,271,276,,10.2307/3899096,,,6,"Agriculture, Dairy & Animal Science; Ecology",Agriculture; Environmental Sciences & Ecology,H3912,WOS:A1987H391200019,,,,,10/31/19J,"DAY, LD; SYLVIA, DM; COLLINS, ME",,,,"DAY, LD; SYLVIA, DM; COLLINS, ME",,,"INTERACTIONS AMONG VESICULAR-ARBUSCULAR MYCORRHIZAE, SOIL, AND LANDSCAPE POSITION",SOIL SCIENCE SOCIETY OF AMERICA JOURNAL,,,English,Article,,,,,,,,,"UNIV FLORIDA,DEPT SOIL SCI,2169 MCCARTY HALL,GAINESVILLE,FL 32611",,,,,,,,23,14,21,0,1,SOIL SCI SOC AMER,MADISON,"677 SOUTH SEGOE ROAD, MADISON, WI 53711",0361-5995,,,SOIL SCI SOC AM J,Soil Sci. Soc. Am. J.,MAY-JUN,1987,51,3,,,,,635,639,,10.2136/sssaj1987.03615995005100030015x,,,5,Soil Science,Agriculture,H6449,WOS:A1987H644900015,,,,,10/31/19J,"BETHLENFALVAY, GJ; AMES, RN",,,,"BETHLENFALVAY, GJ; AMES, RN",,,COMPARISON OF 2 METHODS FOR QUANTIFYING EXTRARADICAL MYCELIUM OF VESICULAR-ARBUSCULAR MYCORRHIZAL FUNGI,SOIL SCIENCE SOCIETY OF AMERICA JOURNAL,,,English,Note,,,,,,,,,,"BETHLENFALVAY, GJ (reprint author), USDA ARS,WESTERN REG RES CTR,PLANT DEV PROD UNIT,PLANT SOIL SYMBIOSIS GRP,ALBANY,CA 94710, USA.",,,,,,,21,71,75,1,8,SOIL SCI SOC AMER,MADISON,"677 SOUTH SEGOE ROAD, MADISON, WI 53711",0361-5995,,,SOIL SCI SOC AM J,Soil Sci. Soc. Am. J.,MAY-JUN,1987,51,3,,,,,834,837,,10.2136/sssaj1987.03615995005100030049x,,,4,Soil Science,Agriculture,H6449,WOS:A1987H644900049,,,,,10/31/19J,"Fagerstedt, KV; Crawford, RMM",,,,"Fagerstedt, K. V.; Crawford, R. M. M.",,,Is anoxia tolerance related to flooding tolerance?,FUNCTIONAL ECOLOGY,,,English,Article,,,,,,anoxia tolerance; flooding tolerance; Hordeum vulgare; localization of anoxic damage; tetrazolium chloride,,"Three barley cultivars, Hordeum vulgare L. cv. Kustaa, Hankkija-673 and Pokko were tested for their anoxia and. flooding tolerance to observe whether anoxia tolerance is related to flooding tolerance and whether the cultivars differ in their anoxia and flooding tolerance. Three-day-old seedlings were incubated under anoxia at +5 degrees C for 10-20 days. In addition a tetrazolium chloride test was carried out to identify the site of anoxic or post-anoxic damage. Flooding tolerance of the barley cultivars was investigated by growing plants to maturity (flowering and seed production) under permanently flooded conditions. The flooding tolerance of the cultivars correlated positively with anoxia tolerance, Kustaa being the most and Pokko the least tolerant and productive of the three tested cultivars. Thus at an intraspecific level anoxia tolerance can be related to flooding tolerance. The TTC-test showed that root tissue, and especially root tips, were more susceptible to anoxia than shoot tissue. The roots of the cultivar Kustaa showed longer tolerance of anoxia than the other two cultivars, with the proximal region of the roots surviving the anoxic treatment. In some cases surviving shoots of the variety Kustaa produced new roots at the base of the stem.","[Fagerstedt, K. V.; Crawford, R. M. M.] Univ St Andrews, Dept Plant Biol & Ecol, St Andrews KY16 9AL, Fife, Scotland","Fagerstedt, KV (reprint author), Univ St Andrews, Dept Plant Biol & Ecol, St Andrews KY16 9AL, Fife, Scotland.",,"Fagerstedt, Kurt.V/AAC-2896-2019","Fagerstedt, Kurt.V/0000-0002-6839-2958",Overseas Research Student grant; Academy of FinlandAcademy of Finland,"This work was supported by an Overseas Research Student grant and a grant from the Academy of Finland to KVF, which are gratefully acknowledged.",,15,12,12,0,8,WILEY-BLACKWELL,HOBOKEN,"111 RIVER ST, HOBOKEN 07030-5774, NJ USA",0269-8463,,,FUNCT ECOL,Funct. Ecol.,,1987,1,1,,,,,49,55,,10.2307/2389357,,,7,Ecology,Environmental Sciences & Ecology,V26ZQ,WOS:000208583900008,,,,,10/31/19J,"DAHM, H; STRZELCZYK, E; MAJEWSKA, L",,,,"DAHM, H; STRZELCZYK, E; MAJEWSKA, L",,,"CELLULOLYTIC AND PECTOLYTIC ACTIVITY OF MYCORRHIZAL FUNGI, BACTERIA AND ACTINOMYCETES ASSOCIATED WITH THE ROOTS OF PINUS-SYLVESTRIS",PEDOBIOLOGIA,,,English,Article,,,,,,,,,,"DAHM, H (reprint author), NICHOLAS COPERNICUS UNIV,INST BIOL,MICROBIOL LAB,UL GAGARINA 9,PL-87100 TORUN,POLAND.",,"Dahm, Hanna/O-8721-2015",,,,,39,9,9,0,0,GUSTAV FISCHER VERLAG,JENA,"VILLENGANG 2, D-07745 JENA, GERMANY",0031-4056,,,PEDOBIOLOGIA,Pedobiologia,,1987,30,2,,,,,73,80,,,,,8,Ecology; Soil Science,Environmental Sciences & Ecology; Agriculture,H1880,WOS:A1987H188000001,,,,,10/31/19J,"PREVOST, D; BORDELEAU, LM; ANTOUN, H",,,,"PREVOST, D; BORDELEAU, LM; ANTOUN, H",,,SYMBIOTIC EFFECTIVENESS OF INDIGENOUS ARCTIC RHIZOBIA ON TEMPERATE FORAGE LEGUME - SAINFOIN (ONOBRYCHIS-VICIIFOLIA),PLANT AND SOIL,,,English,Article,,,,,,,,,"UNIV LAVAL,FAC SCI AGR & ALIMENTAT,DEPT SOLS,QUEBEC CITY G1K 7P4,QUEBEC,CANADA","PREVOST, D (reprint author), AGR CANADA,RECH STN,2560 BOUL HOCHELAGA,ST FOY G1V 2J3,QUEBEC,CANADA.",,"Antoun, Hani/K-3154-2013","Antoun, Hani/0000-0001-9309-420X",,,,15,32,33,0,3,KLUWER ACADEMIC PUBL,DORDRECHT,"SPUIBOULEVARD 50, PO BOX 17, 3300 AA DORDRECHT, NETHERLANDS",0032-079X,,,PLANT SOIL,Plant Soil,,1987,104,1,,,,,63,69,,10.1007/BF02370626,,,7,Agronomy; Plant Sciences; Soil Science,Agriculture; Plant Sciences,K9311,WOS:A1987K931100009,,,,,10/31/19