PT,AU,BA,BE,GP,AF,BF,CA,TI,SO,SE,BS,LA,DT,CT,CY,CL,SP,HO,DE,ID,AB,C1,RP,EM,RI,OI,FU,FX,CR,NR,TC,Z9,U1,U2,PU,PI,PA,SN,EI,BN,J9,JI,PD,PY,VL,IS,PN,SU,SI,MA,BP,EP,AR,DI,D2,EA,PG,WC,SC,GA,UT,PM,OA,HC,HP,DAJ,"IKRAM, A; BROUGHTON, WJ",,,,"IKRAM, A; BROUGHTON, WJ",,,RHIZOBIA IN TROPICAL LEGUMES .7. EFFECTIVENESS OF DIFFERENT ISOLATES ON PSOPHOCARPUS-TETRAGONOLOBUS (L) DC,SOIL BIOLOGY & BIOCHEMISTRY,,,English,Article,,,,,,,,,"UNIV MALAYA,DEPT GENET & CELL BIOL,KUALA LUMPUR 2211,MALAYSIA",,,,,,,,32,10,10,0,2,PERGAMON-ELSEVIER SCIENCE LTD,OXFORD,"THE BOULEVARD, LANGFORD LANE, KIDLINGTON, OXFORD, ENGLAND OX5 1GB",0038-0717,,,SOIL BIOL BIOCHEM,Soil Biol. Biochem.,,1980,12,1,,,,,77,82,,10.1016/0038-0717(80)90105-4,,,6,Soil Science,Agriculture,JD679,WOS:A1980JD67900012,,,,,10/31/19J,"IKRAM, A; BROUGHTON, WJ",,,,"IKRAM, A; BROUGHTON, WJ",,,RHIZOBIA IN TROPICAL LEGUMES .8. SEROLOGICAL CHARACTERISTICS OF PSOPHOCARPUS-TETRAGONOLOBUS (L) DC ISOLATES,SOIL BIOLOGY & BIOCHEMISTRY,,,English,Article,,,,,,,,,"UNIV MALAYA,DEPT GENET & CELL BIOL,KUALA LUMPUR 2211,MALAYSIA",,,,,,,,9,5,5,0,2,PERGAMON-ELSEVIER SCIENCE LTD,OXFORD,"THE BOULEVARD, LANGFORD LANE, KIDLINGTON, OXFORD, ENGLAND OX5 1GB",0038-0717,,,SOIL BIOL BIOCHEM,Soil Biol. Biochem.,,1980,12,1,,,,,83,87,,10.1016/0038-0717(80)90106-6,,,5,Soil Science,Agriculture,JD679,WOS:A1980JD67900013,,,,,10/31/19J,"CHAMBERS, CA; SMITH, SE; SMITH, FA; RAMSEY, MD; NICHOLAS, DJD",,,,"CHAMBERS, CA; SMITH, SE; SMITH, FA; RAMSEY, MD; NICHOLAS, DJD",,,SYMBIOSIS OF TRIFOLIUM-SUBTERRANEUM WITH MYCORRHIZAL FUNGI AND RHIZOBIUM-TRIFOLII AS AFFECTED BY AMMONIUM-SULFATE AND NITRIFICATION INHIBITORS,SOIL BIOLOGY & BIOCHEMISTRY,,,English,Article,,,,,,,,,"UNIV ADELAIDE,DEPT AGR BOT,ADELAIDE 5001,S AUSTRALIA,AUSTRALIA","CHAMBERS, CA (reprint author), UNIV ADELAIDE,DEPT BOT,ADELAIDE 5001,S AUSTRALIA,AUSTRALIA.",,"Smith, Frank Andrew/D-4665-2013",,,,,44,15,15,2,10,PERGAMON-ELSEVIER SCIENCE LTD,OXFORD,"THE BOULEVARD, LANGFORD LANE, KIDLINGTON, OXFORD, ENGLAND OX5 1GB",0038-0717,,,SOIL BIOL BIOCHEM,Soil Biol. Biochem.,,1980,12,2,,,,,93,100,,10.1016/0038-0717(80)90042-5,,,8,Soil Science,Agriculture,JQ894,WOS:A1980JQ89400001,,,,,10/31/19J,"IKRAM, A; BROUGHTON, WJ",,,,"IKRAM, A; BROUGHTON, WJ",,,RHIZOBIA IN TROPICAL LEGUMES .9. POT AND FIELD TRIALS WITH INOCULANTS FOR PSOPHOCARPUS-TETRAGONOLOBUS (L) DC,SOIL BIOLOGY & BIOCHEMISTRY,,,English,Article,,,,,,,,,"UNIV MALAYA,DEPT GENET & CELLULAR BIOL,KUALA LUMPUR 2211,MALAYSIA",,,,,,,,31,12,12,0,1,PERGAMON-ELSEVIER SCIENCE LTD,OXFORD,"THE BOULEVARD, LANGFORD LANE, KIDLINGTON, OXFORD, ENGLAND OX5 1GB",0038-0717,,,SOIL BIOL BIOCHEM,Soil Biol. Biochem.,,1980,12,3,,,,,203,209,,10.1016/0038-0717(80)90063-2,,,7,Soil Science,Agriculture,JV641,WOS:A1980JV64100001,,,,,10/31/19J,"FAIZAH, AW; BROUGHTON, WJ; JOHN, CK",,,,"FAIZAH, AW; BROUGHTON, WJ; JOHN, CK",,,RHIZOBIA IN TROPICAL LEGUMES .10. GROWTH IN COIR-DUST-SOIL COMPOST,SOIL BIOLOGY & BIOCHEMISTRY,,,English,Article,,,,,,,,,"UNIV MALAYA,DEPT GENET & CELLULAR BIOL,KUALA LUMPUR 2211,MALAYSIA","FAIZAH, AW (reprint author), RUBBER RES INST MALAYSIA,DIV CROP PROTECT & MICROBIOL,KUALA LUMPER 0102,MALAYSIA.",,,,,,,37,7,7,0,1,PERGAMON-ELSEVIER SCIENCE LTD,OXFORD,"THE BOULEVARD, LANGFORD LANE, KIDLINGTON, OXFORD, ENGLAND OX5 1GB",0038-0717,,,SOIL BIOL BIOCHEM,Soil Biol. Biochem.,,1980,12,3,,,,,211,218,,10.1016/0038-0717(80)90064-4,,,8,Soil Science,Agriculture,JV641,WOS:A1980JV64100002,,,,,10/31/19J,"FAIZAH, AW; BROUGHTON, WJ; JOHN, CK",,,,"FAIZAH, AW; BROUGHTON, WJ; JOHN, CK",,,RHIZOBIA IN TROPICAL LEGUMES .11. SURVIVAL IN THE SEED ENVIRONMENT,SOIL BIOLOGY & BIOCHEMISTRY,,,English,Article,,,,,,,,,"RUBBER RES INST MALAYSIA,DIV CROP PROTECT & MICROBIOL,KUALA LUMPER 0102,MALAYSIA","FAIZAH, AW (reprint author), UNIV MALAYA,DEPT GENET & CELLULAR BIOL,KUALA LUMPUR 2211,MALAYSIA.",,,,,,,74,14,14,1,1,PERGAMON-ELSEVIER SCIENCE LTD,OXFORD,"THE BOULEVARD, LANGFORD LANE, KIDLINGTON, OXFORD, ENGLAND OX5 1GB",0038-0717,,,SOIL BIOL BIOCHEM,Soil Biol. Biochem.,,1980,12,3,,,,,219,227,,10.1016/0038-0717(80)90065-6,,,9,Soil Science,Agriculture,JV641,WOS:A1980JV64100003,,,,,10/31/19J,"CARLING, DE; BROWN, MF",,,,"CARLING, DE; BROWN, MF",,,RELATIVE EFFECT OF VESICULAR-ARBUSCULAR MYCORRHIZAL FUNGI ON THE GROWTH AND YIELD OF SOYBEANS,SOIL SCIENCE SOCIETY OF AMERICA JOURNAL,,,English,Article,,,,,,,,,"UNIV MISSOURI,DEPT PLANT PATHOL,COLUMBIA,MO 65201","CARLING, DE (reprint author), VIRGINIA TRUCK & ORNAMENTALS RES STN,1444 DIAMOND SPRINGS RD,VIRGINIA BEACH,VA 23455, USA.",,,,,,,21,64,67,0,5,SOIL SCI SOC AMER,MADISON,"677 SOUTH SEGOE ROAD, MADISON, WI 53711",0361-5995,,,SOIL SCI SOC AM J,Soil Sci. Soc. Am. J.,,1980,44,3,,,,,528,532,,10.2136/sssaj1980.03615995004400030018x,,,5,Soil Science,Agriculture,JZ863,WOS:A1980JZ86300018,,,,,10/31/19J,"HIRREL, MC; GERDEMANN, JW",,,,"HIRREL, MC; GERDEMANN, JW",,,IMPROVED GROWTH OF ONION AND BELL PEPPER IN SALINE SOILS BY 2 VESICULAR-ARBUSCULAR MYCORRHIZAL FUNGI,SOIL SCIENCE SOCIETY OF AMERICA JOURNAL,,,English,Note,,,,,,,,,,"HIRREL, MC (reprint author), UNIV ILLINOIS,DEPT PLANT PATHOL,URBANA,IL 61801, USA.",,,,,,,7,91,108,0,12,SOIL SCI SOC AMER,MADISON,"677 SOUTH SEGOE ROAD, MADISON, WI 53711",0361-5995,,,SOIL SCI SOC AM J,Soil Sci. Soc. Am. J.,,1980,44,3,,,,,654,655,,10.2136/sssaj1980.03615995004400030046x,,,2,Soil Science,Agriculture,JZ863,WOS:A1980JZ86300046,,,,,10/31/19J,"MAHLER, RL; WOLLUM, AG",,,,"MAHLER, RL; WOLLUM, AG",,,INFLUENCE OF WATER POTENTIAL ON THE SURVIVAL OF RHIZOBIA IN A GOLDSBORO LOAMY SAND,SOIL SCIENCE SOCIETY OF AMERICA JOURNAL,,,English,Article,,,,,,,,,"N CAROLINA AGR RES SERV,RALEIGH,NC 27607",,,"Mahler, Robert/N-9313-2019",,,,,26,30,31,0,0,SOIL SCI SOC AMER,MADISON,"677 SOUTH SEGOE ROAD, MADISON, WI 53711",0361-5995,,,SOIL SCI SOC AM J,Soil Sci. Soc. Am. J.,,1980,44,5,,,,,988,992,,10.2136/sssaj1980.03615995004400050023x,,,5,Soil Science,Agriculture,KS005,WOS:A1980KS00500023,,,,,10/31/19J,"PERSSON, H",,,,"PERSSON, H",,,"FINE-ROOT PRODUCTION, MORTALITY AND DECOMPOSITION IN FOREST ECOSYSTEMS",VEGETATIO,,,English,Article,,,,,,,,,,"PERSSON, H (reprint author), INST ECOL BOT,POB 559,S-75122 UPPSALA,SWEDEN.",,,,,,,54,32,34,0,14,KLUWER ACADEMIC PUBL,DORDRECHT,"SPUIBOULEVARD 50, PO BOX 17, 3300 AA DORDRECHT, NETHERLANDS",0042-3106,,,VEGETATIO,Vegetatio,,1980,41,2,,,,,101,109,,10.1007/BF00121422,,,9,Plant Sciences; Ecology; Forestry,Plant Sciences; Environmental Sciences & Ecology; Forestry,JU784,WOS:A1980JU78400006,,,,,10/31/19J,"LAMB, RJ",,,,"LAMB, RJ",,,FACTORS RESPONSIBLE FOR THE DISTRIBUTION OF MYCORRHIZAL FUNGI OF PINUS IN EASTERN AUSTRALIA,AUSTRALIAN FOREST RESEARCH,,,English,Article,,,,,,,,,,"LAMB, RJ (reprint author), NEW S WALES INST TECHNOL,SCH LIFE SCI,POB 123,BROADWAY 2007,NEW S WALES,AUSTRALIA.",,,,,,,0,37,37,0,0,C S I R O PUBLICATIONS,COLLINGWOOD,"150 OXFORD ST, PO BOX 1139, COLLINGWOOD VICTORIA 3066, AUSTRALIA",0004-914X,,,AUST FOREST RES,,,1979,9,1,,,,,25,34,,,,,10,Forestry,Forestry,HH257,WOS:A1979HH25700004,,,,,10/31/19J,"PORTER, WM",,,,"PORTER, WM",,,MOST PROBABLE NUMBER METHOD FOR ENUMERATING INFECTIVE PROPAGULES OF VESICULAR ARBUSCULAR MYCORRHIZAL FUNGI IN SOIL,AUSTRALIAN JOURNAL OF SOIL RESEARCH,,,English,Note,,,,,,,,,,"PORTER, WM (reprint author), UNIV WESTERN AUSTRALIA,DEPT SOIL SCI & PLANT NUTR,NEDLANDS 6009,W AUSTRALIA,AUSTRALIA.",,,,,,,17,285,307,0,12,C S I R O PUBLICATIONS,COLLINGWOOD,"150 OXFORD ST, PO BOX 1139, COLLINGWOOD VICTORIA 3066, AUSTRALIA",Apr-73,,,AUST J SOIL RES,Aust. J. Soil Res.,,1979,17,3,,,,,515,519,,10.1071/SR9790515,,,5,Soil Science,Agriculture,JE064,WOS:A1979JE06400014,,,,,10/31/19J,"ALVAREZ, IF; ROWNEY, DL; COBB, FW",,,,"ALVAREZ, IF; ROWNEY, DL; COBB, FW",,,MYCORRHIZAE AND GROWTH OF WHITE FIR SEEDLINGS IN MINERAL SOIL WITH AND WITHOUT ORGANIC LAYERS IN A CALIFORNIA FOREST,CANADIAN JOURNAL OF FOREST RESEARCH-REVUE CANADIENNE DE RECHERCHE FORESTIERE,,,English,Article,,,,,,,,,"UNIV CALIF BERKELEY,DEPT PLANT PATHOL,BERKELEY,CA 94720",,,,,,,,15,23,23,1,1,NATL RESEARCH COUNCIL CANADA,OTTAWA,"RESEARCH JOURNALS, MONTREAL RD, OTTAWA ON K1A 0R6, CANADA",0045-5067,,,CAN J FOREST RES,Can. J. For. Res.-Rev. Can. Rech. For.,,1979,9,3,,,,,311,315,,10.1139/x79-053,,,5,Forestry,Forestry,HL460,WOS:A1979HL46000003,,,,,10/31/19J,"BUCKING, E",,,,"BUCKING, E",,,SPRUCE MYCORRHIZAE AND HEART ROT INCIDENCE CAUSED BY FOMES ANNOSUS IN SOUTHWESTERN GERMANY,EUROPEAN JOURNAL OF FOREST PATHOLOGY,,,German,Article,,,,,,,,,"FORSTLICHE VERSUCHS & FORSCHUNGSANSTALT BADEN WURTTEMBERG,STUTTGART,FED REP GER",,,,,,,,0,2,2,0,0,BLACKWELL WISSENSCHAFTS-VERLAG GMBH,BERLIN,"KURFURSTENDAMM 57, D-10707 BERLIN, GERMANY",0300-1237,,,EUR J FOREST PATHOL,Eur. J. Forest Pathol.,,1979,9,1,,,,,19,35,,,,,17,Forestry,Forestry,GU468,WOS:A1979GU46800004,,,,,10/31/19J,"SHUFFSTALL, WC; MEDVE, RJ",,,,"SHUFFSTALL, WC; MEDVE, RJ",,,GROWTH PERFORMANCES AND MYCORRHIZAE OF NATIVE AND EXOTIC HARDWOODS ON BITUMINOUS STRIP-MINE SPOILS,OHIO JOURNAL OF SCIENCE,,,English,Note,,,,,,,,,"SLIPPERY ROCK STATE COLL,DEPT BIOL,SLIPPERY ROCK,PA 16057",,,,,,,,15,4,4,0,2,OHIO ACAD SCIENCE,COLUMBUS,"1500 W 3RD AVE SUITE 223, COLUMBUS, OH 43212-2817",0030-0950,,,OHIO J SCI,Ohio J. Sci.,,1979,79,6,,,,,274,279,,,,,6,Ecology; Zoology,Environmental Sciences & Ecology; Zoology,HT822,WOS:A1979HT82200007,,,,,10/31/19J,"DEANS, JD",,,,"DEANS, JD",,,FLUCTUATIONS OF THE SOIL ENVIRONMENT AND FINE ROOT-GROWTH IN A YOUNG SITKA SPRUCE PLANTATION,PLANT AND SOIL,,,English,Article,,,,,,,,,,"DEANS, JD (reprint author), INST TERR ECOL,BUSH ESTATE,PENICUIK EH26 0QB,MIDLOTHIAN,SCOTLAND.",,,,,,,28,88,91,0,10,KLUWER ACADEMIC PUBL,DORDRECHT,"SPUIBOULEVARD 50, PO BOX 17, 3300 AA DORDRECHT, NETHERLANDS",0032-079X,,,PLANT SOIL,Plant Soil,,1979,52,2,,,,,195,208,,10.1007/BF02184560,,,14,Agronomy; Plant Sciences; Soil Science,Agriculture; Plant Sciences,HG233,WOS:A1979HG23300005,,,,,10/31/19J,"ODUNFA, VSA",,,,"ODUNFA, VSA",,,FREE AMINO-ACIDS IN THE SEED AND ROOT EXUDATES IN RELATION TO THE NITROGEN REQUIREMENTS OF RHIZOSPHERE SOIL FUSARIA,PLANT AND SOIL,,,English,Article,,,,,,,,,,"ODUNFA, VSA (reprint author), UNIV IBADAN,DEPT BOT,IBADAN,NIGERIA.",,,,,,,26,13,13,0,3,KLUWER ACADEMIC PUBL,DORDRECHT,"SPUIBOULEVARD 50, PO BOX 17, 3300 AA DORDRECHT, NETHERLANDS",0032-079X,,,PLANT SOIL,Plant Soil,,1979,52,4,,,,,491,499,,10.1007/BF02277944,,,9,Agronomy; Plant Sciences; Soil Science,Agriculture; Plant Sciences,JD446,WOS:A1979JD44600004,,,,,10/31/19J,"KANDASAMY, D; PRASAD, NN",,,,"KANDASAMY, D; PRASAD, NN",,,COLONIZATION BY RHIZOBIA OF THE SEED AND ROOTS OF LEGUMES IN RELATION TO EXUDATION OF PHENOLICS,SOIL BIOLOGY & BIOCHEMISTRY,,,English,Article,,,,,,,,,"ANNAMALAI UNIV,FAC AGR,DEPT MICROBIOL,ANNAMALAINAGAR 608101,TAMIL NADU,INDIA",,,,,,,,13,5,5,0,0,PERGAMON-ELSEVIER SCIENCE LTD,OXFORD,"THE BOULEVARD, LANGFORD LANE, KIDLINGTON, OXFORD, ENGLAND OX5 1GB",0038-0717,,,SOIL BIOL BIOCHEM,Soil Biol. Biochem.,,1979,11,1,,,,,73,75,,10.1016/0038-0717(79)90121-4,,,3,Soil Science,Agriculture,GG538,WOS:A1979GG53800013,,,,,10/31/19J,"HALL, IR",,,,"HALL, IR",,,SOIL PELLETS TO INTRODUCE VESICULAR-ARBUSCULAR MYCORRHIZAL FUNGI INTO SOIL,SOIL BIOLOGY & BIOCHEMISTRY,,,English,Note,,,,,,,,,,"HALL, IR (reprint author), INVERMAY AGR RES CTR,PRIVATE BAG,MOSGIEL,NEW ZEALAND.",,,,,,,13,19,20,0,0,PERGAMON-ELSEVIER SCIENCE LTD,OXFORD,"THE BOULEVARD, LANGFORD LANE, KIDLINGTON, OXFORD, ENGLAND OX5 1GB",0038-0717,,,SOIL BIOL BIOCHEM,Soil Biol. Biochem.,,1979,11,1,,,,,85,86,,10.1016/0038-0717(79)90123-8,,,2,Soil Science,Agriculture,GG538,WOS:A1979GG53800015,,,,,10/31/19J,"COOPER, JE",,,,"COOPER, JE",,,RAPID METHOD FOR COUNTING ANTIBIOTIC-RESISTANT RHIZOBIA IN SOILS,SOIL BIOLOGY & BIOCHEMISTRY,,,English,Note,,,,,,,,,"DEPT AGR, BELFAST, ANTRIM, NORTH IRELAND","COOPER, JE (reprint author), QUEENS UNIV BELFAST, DEPT AGR & FOOD BACTERIOL, BELFAST BT9 5PX, ANTRIM, NORTH IRELAND.",,,,,,,7,12,12,0,0,PERGAMON-ELSEVIER SCIENCE LTD,OXFORD,"THE BOULEVARD, LANGFORD LANE, KIDLINGTON, OXFORD OX5 1GB, ENGLAND",0038-0717,,,SOIL BIOL BIOCHEM,Soil Biol. Biochem.,,1979,11,4,,,,,433,435,,10.1016/0038-0717(79)90058-0,,,3,Soil Science,Agriculture,HH387,WOS:A1979HH38700017,,,,,10/31/19J,"PANTHIER, JJ; DIEM, HG; DOMMERGUES, Y",,,,"PANTHIER, JJ; DIEM, HG; DOMMERGUES, Y",,,RAPID METHOD TO ENUMERATE AND ISOLATE SOIL ACTINOMYCETES ANTAGONISTIC TOWARDS RHIZOBIA,SOIL BIOLOGY & BIOCHEMISTRY,,,English,Note,,,,,,,,,,"PANTHIER, JJ (reprint author), ORSTOM,CNRS,MICROBIOL LAB,BP 1386,DAKAR,SENEGAL.",,"PANTHIER, Jean-Jacques/I-4366-2014","PANTHIER, Jean-Jacques/0000-0002-7966-0663",,,,11,15,17,0,1,PERGAMON-ELSEVIER SCIENCE LTD,OXFORD,"THE BOULEVARD, LANGFORD LANE, KIDLINGTON, OXFORD, ENGLAND OX5 1GB",0038-0717,,,SOIL BIOL BIOCHEM,Soil Biol. Biochem.,,1979,11,4,,,,,443,445,,10.1016/0038-0717(79)90061-0,,,3,Soil Science,Agriculture,HH387,WOS:A1979HH38700020,,,,,10/31/19J,"CHUCHOU, M",,,,"CHUCHOU, M",,,MYCORRHIZAL FUNGI OF PINUS-RADIATA IN NEW-ZEALAND,SOIL BIOLOGY & BIOCHEMISTRY,,,English,Article,,,,,,,,,,"CHUCHOU, M (reprint author), FOREST RES INST,ROTORUA,NEW ZEALAND.",,,,,,,19,84,89,0,6,PERGAMON-ELSEVIER SCIENCE LTD,OXFORD,"THE BOULEVARD, LANGFORD LANE, KIDLINGTON, OXFORD, ENGLAND OX5 1GB",0038-0717,,,SOIL BIOL BIOCHEM,Soil Biol. Biochem.,,1979,11,6,,,,,557,562,,10.1016/0038-0717(79)90021-X,,,6,Soil Science,Agriculture,HZ562,WOS:A1979HZ56200001,,,,,10/31/19J,"KEYSER, HH; MUNNS, DN",,,,"KEYSER, HH; MUNNS, DN",,,"EFFECTS OF CALCIUM, MANGANESE, AND ALUMINUM ON GROWTH OF RHIZOBIA IN ACID-MEDIA",SOIL SCIENCE SOCIETY OF AMERICA JOURNAL,,,English,Article,,,,,,,,,"UNIV CALIF DAVIS,DEPT LAND AIR & WATER RESOURCES,DAVIS,CA 95616",,,,,,,,17,69,72,1,4,SOIL SCI SOC AMER,MADISON,"677 SOUTH SEGOE ROAD, MADISON, WI 53711",0361-5995,,,SOIL SCI SOC AM J,Soil Sci. Soc. Am. J.,,1979,43,3,,,,,500,503,,10.2136/sssaj1979.03615995004300030014x,,,4,Soil Science,Agriculture,HD234,WOS:A1979HD23400014,,,,,10/31/19J,"HAGEDORN, C",,,,"HAGEDORN, C",,,NODULATION OF TRIFOLIUM-SUBTERRANEUM L BY INTRODUCED RHIZOBIA IN SOUTHWEST OREGON SOILS,SOIL SCIENCE SOCIETY OF AMERICA JOURNAL,,,English,Article,,,,,,,,,"OREGON STATE UNIV,DEPT SOIL SCI,AGR EXPT STN,CORVALLIS,OR 97331",,,,,,,,16,12,12,0,0,SOIL SCI SOC AMER,MADISON,"677 SOUTH SEGOE ROAD, MADISON, WI 53711",0361-5995,,,SOIL SCI SOC AM J,Soil Sci. Soc. Am. J.,,1979,43,3,,,,,515,519,,10.2136/sssaj1979.03615995004300030017x,,,5,Soil Science,Agriculture,HD234,WOS:A1979HD23400017,,,,,10/31/19J,"KEYSER, HH; MUNNS, DN",,,,"KEYSER, HH; MUNNS, DN",,,"TOLERANCE OF RHIZOBIA TO ACIDITY, ALUMINUM, AND PHOSPHATE",SOIL SCIENCE SOCIETY OF AMERICA JOURNAL,,,English,Article,,,,,,,,,"UNIV CALIF DAVIS,DEPT LAND AIR & WATER RESOURCES,DAVIS,CA 95616",,,,,,,,23,142,143,1,7,SOIL SCI SOC AMER,MADISON,"677 SOUTH SEGOE ROAD, MADISON, WI 53711",0361-5995,,,SOIL SCI SOC AM J,Soil Sci. Soc. Am. J.,,1979,43,3,,,,,519,523,,10.2136/sssaj1979.03615995004300030018x,,,5,Soil Science,Agriculture,HD234,WOS:A1979HD23400018,,,,,10/31/19J,"KEYSER, HH; MUNNS, DN; HOHENBERG, JS",,,,"KEYSER, HH; MUNNS, DN; HOHENBERG, JS",,,ACID TOLERANCE OF RHIZOBIA IN CULTURE AND IN SYMBIOSIS WITH COWPEA,SOIL SCIENCE SOCIETY OF AMERICA JOURNAL,,,English,Article,,,,,,,,,,"KEYSER, HH (reprint author), UNIV CALIF DAVIS,DEPT LAND AIR & WATER RESOURCES,DAVIS,CA 95616, USA.",,,,,,,9,38,38,0,1,SOIL SCI SOC AMER,MADISON,"677 SOUTH SEGOE ROAD, MADISON, WI 53711",0361-5995,,,SOIL SCI SOC AM J,Soil Sci. Soc. Am. J.,,1979,43,4,,,,,719,722,,10.2136/sssaj1979.03615995004300040018x,,,4,Soil Science,Agriculture,HL606,WOS:A1979HL60600018,,,,,10/31/19J,"SMITH, GW; SKIPPER, HD",,,,"SMITH, GW; SKIPPER, HD",,,COMPARISON OF METHODS TO EXTRACT SPORES OF VESICULAR-ARBUSCULAR MYCORRHIZAL FUNGI,SOIL SCIENCE SOCIETY OF AMERICA JOURNAL,,,English,Article,,,,,,,,,"CLEMSON UNIV,DEPT AGRON & SOILS,CLEMSON,SC 29631",,,,,,,,15,38,41,0,7,SOIL SCI SOC AMER,MADISON,"677 SOUTH SEGOE ROAD, MADISON, WI 53711",0361-5995,,,SOIL SCI SOC AM J,Soil Sci. Soc. Am. J.,,1979,43,4,,,,,722,725,,10.2136/sssaj1979.03615995004300040019x,,,4,Soil Science,Agriculture,HL606,WOS:A1979HL60600019,,,,,10/31/19J,"LAMBERT, DH; BAKER, DE; COLE, H",,,,"LAMBERT, DH; BAKER, DE; COLE, H",,,"ROLE OF MYCORRHIZAE IN THE INTERACTIONS OF PHOSPHORUS WITH ZINC, COPPER, AND OTHER ELEMENTS",SOIL SCIENCE SOCIETY OF AMERICA JOURNAL,,,English,Article,,,,,,,,,,"LAMBERT, DH (reprint author), PENN STATE UNIV,UNIVERSITY PK,PA 16802, USA.",,,,,,,37,176,192,0,20,SOIL SCI SOC AMER,MADISON,"677 SOUTH SEGOE ROAD, MADISON, WI 53711",0361-5995,,,SOIL SCI SOC AM J,Soil Sci. Soc. Am. J.,,1979,43,5,,,,,976,980,,10.2136/sssaj1979.03615995004300050033x,,,5,Soil Science,Agriculture,HT845,WOS:A1979HT84500033,,,,,10/31/19J,"SOOS, T; KONYA, K",,,,"SOOS, T; KONYA, K",,,FIELD EXPERIMENTS ON A BROWN FOREST SOIL WITH INOCULA PREPARED WITH SOYBEAN RHIZOBIA,AGROKEMIA ES TALAJTAN,,,Hungarian,Article,,,,,,,,,,"SOOS, T (reprint author), PHYLAXIA VET BIOL & FEEDSTUFFS CO,BUDAPEST,HUNGARY.",,,,,,,0,0,0,0,0,AKADEMIAI KIADO,BUDAPEST,"PO BOX 245, H-1519 BUDAPEST, HUNGARY",0002-1873,,,AGROKEM TALAJTAN,,,1978,27,4-Mar,,,,,445,450,,,,,6,Agronomy; Soil Science,Agriculture,GP765,WOS:A1978GP76500013,,,,,10/31/19J,"KIMMINS, JP; HAWKES, BC",,,,"KIMMINS, JP; HAWKES, BC",,,DISTRIBUTION AND CHEMISTRY OF FINE ROOTS IN A WHITE SPRUCE - SUBALPINE FIR STAND IN BRITISH-COLUMBIA - IMPLICATIONS FOR MANAGEMENT,CANADIAN JOURNAL OF FOREST RESEARCH-REVUE CANADIENNE DE RECHERCHE FORESTIERE,,,English,Article,,,,,,,,,,"KIMMINS, JP (reprint author), UNIV BRITISH COLUMBIA,FAC FORESTRY,VANCOUVER V6T 1W5,BC,CANADA.",,,,,,,0,85,91,1,10,NATL RESEARCH COUNCIL CANADA,OTTAWA,"RESEARCH JOURNALS, MONTREAL RD, OTTAWA ON K1A 0R6, CANADA",0045-5067,,,CAN J FOREST RES,Can. J. For. Res.-Rev. Can. Rech. For.,,1978,8,3,,,,,265,279,,10.1139/x78-042,,,15,Forestry,Forestry,FX235,WOS:A1978FX23500001,,,,,10/31/19J,"SPITKO, RA; TATTAR, TA; ROHDE, RA",,,,"SPITKO, RA; TATTAR, TA; ROHDE, RA",,,INCIDENCE AND CONDITION OF VESICULAR-ARBUSCULAR MYCORRHIZAE INFECTIONS IN THE ROOTS OF SUGAR MAPLE IN RELATION TO MAPLE DECLINE,CANADIAN JOURNAL OF FOREST RESEARCH-REVUE CANADIENNE DE RECHERCHE FORESTIERE,,,English,Article,,,,,,,,,,"SPITKO, RA (reprint author), UNIV MASSACHUSETTS,DEPT PLANT PATHOL,AMHERST,MA 01003, USA.",,,,,,,0,16,16,0,1,NATL RESEARCH COUNCIL CANADA,OTTAWA,"RESEARCH JOURNALS, MONTREAL RD, OTTAWA ON K1A 0R6, CANADA",0045-5067,,,CAN J FOREST RES,Can. J. For. Res.-Rev. Can. Rech. For.,,1978,8,4,,,,,375,379,,10.1139/x78-056,,,5,Forestry,Forestry,GG884,WOS:A1978GG88400003,,,,,10/31/19J,"TETREAULT, JP; BERNIER, B; FORTIN, JA",,,,"TETREAULT, JP; BERNIER, B; FORTIN, JA",,,NITROGEN-FERTILIZATION AND MYCORRHIZAE OF BALSAM FIR SEEDLINGS IN NATURAL STANDS,NATURALISTE CANADIEN,,,English,Article,,,,,,,,,,"TETREAULT, JP (reprint author), UNIV LAVAL,FAC FORESTERIE & GEODESIE,DEPT ECOL & PEDOL,QUEBEC CITY G1K 7P4,QUEBEC,CANADA.",,,,,,,0,14,15,0,0,PRESSES UNIV LAVAL,QUEBEC CITY,"C P 2447, QUEBEC CITY G1K 7R4, CANADA",0028-0798,,,NAT CAN,,,1978,105,6,,,,,461,466,,,,,6,Ecology,Environmental Sciences & Ecology,GV094,WOS:A1978GV09400005,,,,,10/31/19J,"KUMMEROW, J; KRAUSE, D; JOW, W",,,,"KUMMEROW, J; KRAUSE, D; JOW, W",,,SEASONAL-CHANGES OF FINE ROOT DENSITY IN SOUTHERN CALIFORNIAN CHAPARRAL,OECOLOGIA,,,English,Article,,,,,,,,,,"KUMMEROW, J (reprint author), CALIF STATE UNIV SAN DIEGO,DEPT BOT,SAN DIEGO,CA 92182, USA.",,,,,,,22,59,59,0,9,SPRINGER VERLAG,NEW YORK,"175 FIFTH AVE, NEW YORK, NY 10010",0029-8549,,,OECOLOGIA,Oecologia,,1978,37,2,,,,,201,212,,10.1007/BF00344991,,,12,Ecology,Environmental Sciences & Ecology,GC126,WOS:A1978GC12600005,28309650,,,,10/31/19J,"BILLES, G",,,,"BILLES, G",,,PRODUCTION AND TRANSFORMATION OF C-14-LABELED ROOT EXUDATES IN A GRASSLAND SOIL,OECOLOGIA PLANTARUM,,,French,Article,,,,,,,,,,"BILLES, G (reprint author), CNRS,CEPE,ROUTE MENDE,BP 5051,F-34033 MONTPELLIER,FRANCE.",,,,,,,17,1,1,1,4,GAUTHIER-VILLARS,PARIS,"120 BLVD SAINT-GERMAIN, 75280 PARIS, FRANCE",0029-8557,,,OECOLOG PLANTAR,,,1978,13,4,,,,,339,353,,,,,15,Plant Sciences; Ecology,Plant Sciences; Environmental Sciences & Ecology,GE959,WOS:A1978GE95900005,,,,,10/31/19J,"PATEL, JJ",,,,"PATEL, JJ",,,SYMBIOTIC EFFECTIVENESS OF PHAGE-RESISTANT MUTANTS OF 2 STRAINS OF LOTUS RHIZOBIA,PLANT AND SOIL,,,English,Article,,,,,,,,,,"PATEL, JJ (reprint author), DSIR,DIV APPL BIOCHEM,PALMERSTON NORTH,NEW ZEALAND.",,,,,,,13,17,17,0,0,KLUWER ACADEMIC PUBL,DORDRECHT,"SPUIBOULEVARD 50, PO BOX 17, 3300 AA DORDRECHT, NETHERLANDS",0032-079X,,,PLANT SOIL,Plant Soil,,1978,49,2,,,,,251,257,,10.1007/BF02149734,,,7,Agronomy; Plant Sciences; Soil Science,Agriculture; Plant Sciences,FB247,WOS:A1978FB24700003,,,,,10/31/19J,"CANNELL, MGR; BRIDGWATER, FE; GREENWOOD, MS",,,,"CANNELL, MGR; BRIDGWATER, FE; GREENWOOD, MS",,,"SEEDLING GROWTH-RATES, WATER-STRESS RESPONSES AND ROOT-SHOOT RELATIONSHIPS RELATED TO 8-YEAR VOLUMES AMONG FAMILIES OF PINUS-TAEDA L",SILVAE GENETICA,,,English,Article,,,,,,,,,,"CANNELL, MGR (reprint author), INST TERR ECOL,PENICUIK,MIDLOTHIAN,SCOTLAND.",,,,,,,0,76,76,0,3,SAUERLANDERS VERLAG,FRANKFURT,"FINKENHOFSTRASSE 21, W-6000 FRANKFURT, GERMANY",0037-5349,,,SILVAE GENET,Silvae Genet.,,1978,27,6,,,,,237,248,,,,,12,Forestry; Genetics & Heredity,Forestry; Genetics & Heredity,HC211,WOS:A1978HC21100006,,,,,10/31/19J,"GRASSIA, A; BROCKWELL, J",,,,"GRASSIA, A; BROCKWELL, J",,,ENUMERATION OF RHIZOBIA FROM A PLANT-INFECTION DILUTION ASSAY USING TEST PLANTS GROWN IN VERMICULITE,SOIL BIOLOGY & BIOCHEMISTRY,,,English,Article,,,,,,,,,"CSIRO,DIV PLANT IND,CANBERRA 2601,ACT,AUSTRALIA","GRASSIA, A (reprint author), CSIRO,DIV MATH & STAT,CANBERRA 2601,ACT,AUSTRALIA.",,,,,,,10,8,8,0,0,PERGAMON-ELSEVIER SCIENCE LTD,OXFORD,"THE BOULEVARD, LANGFORD LANE, KIDLINGTON, OXFORD, ENGLAND OX5 1GB",0038-0717,,,SOIL BIOL BIOCHEM,Soil Biol. Biochem.,,1978,10,2,,,,,101,104,,10.1016/0038-0717(78)90078-0,,,4,Soil Science,Agriculture,EX108,WOS:A1978EX10800003,,,,,10/31/19J,"LAMB, RJ; RICHARDS, BN",,,,"LAMB, RJ; RICHARDS, BN",,,INOCULATION OF PINES WITH MYCORRHIZAL FUNGI IN NATURAL SOILS .3. EFFECT OF SOIL FUMIGATION ON RATE OF INFECTION AND RESPONSE TO INOCULUM DENSITY,SOIL BIOLOGY & BIOCHEMISTRY,,,English,Article,,,,,,,,,"UNIV NEW ENGLAND,ARMIDALE 2351,NEW S WALES,AUSTRALIA","LAMB, RJ (reprint author), NEW S WALES INST TECHNOL,BROADWAY 2007,AUSTRALIA.",,,,,,,9,9,9,0,0,PERGAMON-ELSEVIER SCIENCE LTD,OXFORD,"THE BOULEVARD, LANGFORD LANE, KIDLINGTON, OXFORD, ENGLAND OX5 1GB",0038-0717,,,SOIL BIOL BIOCHEM,Soil Biol. Biochem.,,1978,10,4,,,,,273,276,,10.1016/0038-0717(78)90021-4,,,4,Soil Science,Agriculture,FL345,WOS:A1978FL34500004,,,,,10/31/19J,"RHODES, LH; GERDEMANN, JW",,,,"RHODES, LH; GERDEMANN, JW",,,HYPHAL TRANSLOCATION AND UPTAKE OF SULFUR BY VESICULAR-ARBUSCULAR MYCORRHIZAE OF ONION,SOIL BIOLOGY & BIOCHEMISTRY,,,English,Article,,,,,,,,,"UNIV ILLINOIS,DEPT PLANT PATHOL,URBANA,IL 61801",,,,,,,,18,46,47,0,6,PERGAMON-ELSEVIER SCIENCE LTD,OXFORD,"THE BOULEVARD, LANGFORD LANE, KIDLINGTON, OXFORD, ENGLAND OX5 1GB",0038-0717,,,SOIL BIOL BIOCHEM,Soil Biol. Biochem.,,1978,10,5,,,,,355,360,,10.1016/0038-0717(78)90057-3,,,6,Soil Science,Agriculture,FS334,WOS:A1978FS33400002,,,,,10/31/19J,"RHODES, LH; GERDEMANN, JW",,,,"RHODES, LH; GERDEMANN, JW",,,TRANSLOCATION OF CALCIUM AND PHOSPHATE BY EXTERNAL HYPHAE OF VESICULAR-ARBUSCULAR MYCORRHIZAE,SOIL SCIENCE,,,English,Note,,,,,,,,,"UNIV ILLINOIS,DEPT PLANT PATHOL,URBANA,IL 61801",,,,,,,,12,54,57,0,9,WILLIAMS & WILKINS,BALTIMORE,"351 WEST CAMDEN ST, BALTIMORE, MD 21201-2436",0038-075X,,,SOIL SCI,Soil Sci.,,1978,126,2,,,,,125,126,,10.1097/00010694-197808000-00009,,,2,Soil Science,Agriculture,FN569,WOS:A1978FN56900009,,,,,10/31/19J,"TARAFDAR, JC; CHHONKAR, PK",,,,"TARAFDAR, JC; CHHONKAR, PK",,,"THERMAL SENSITIVITY AND MICHAELIS CONSTANTS OF ACID, NEUTRAL AND ALKALINE-PHOSPHATASES IN DIFFERENT SOILS AND ROOT EXUDATES",ZEITSCHRIFT FUR PFLANZENERNAHRUNG UND BODENKUNDE,,,English,Article,,,,,,,,,"INDIAN AGR RES INST,DIV SOIL SCI & AGR CHEM SOIL BIOL LAB,NEW DELHI 110012,INDIA",,,,,,,,0,3,3,0,3,VCH PUBLISHERS INC,DEERFIELD BEACH,"303 NW 12TH AVE, DEERFIELD BEACH, FL 33442-1788",0044-3263,,,Z PFLANZ BODENKUNDE,Z. Pflanzen. Bodenk.,,1978,141,6,,,,,753,759,,10.1002/jpln.19781410612,,,7,Agronomy; Plant Sciences; Soil Science,Agriculture; Plant Sciences,GF104,WOS:A1978GF10400011,,,,,10/31/19J,"RIEDACKER, A; PODA, U",,,,"RIEDACKER, A; PODA, U",,,ROOT SYSTEMS OF BEECH AND OAK SEEDLINGS .1. MODIFICATION OF THEIR MORPHOGENESIS BY ROOT-TIP DECAPITATION AND PRACTICAL APPLICATION,ANNALES DES SCIENCES FORESTIERES,,,French,Article,,,,,,,,,"INRA,CTR NATL RECH FORESTIERES,SYLVICULTURE & PROD STN,F-54280 CHAMPENOUX,FRANCE",,,,,,,,0,5,6,0,2,EDITIONS SCIENTIFIQUES MEDICALES ELSEVIER,PARIS,"141 RUE JAVEL, 75747 PARIS, FRANCE",12-Mar,,,ANN SCI FOREST,Ann. Sci. For.,,1977,34,2,,,,,111,135,,10.1051/forest/19770202,,,25,Forestry,Forestry,DU592,WOS:A1977DU59200002,,Bronze,,,10/31/19J,"RICE, WA; PENNEY, DC; NYBORG, M",,,,"RICE, WA; PENNEY, DC; NYBORG, M",,,"EFFECTS OF SOIL ACIDITY ON RHIZOBIA NUMBERS, NODULATION AND NITROGEN-FIXATION BY ALFALFA AND RED-CLOVER",CANADIAN JOURNAL OF SOIL SCIENCE,,,English,Article,,,,,,,,,"AGR CANADA,RES STN,BEAVERLODGE T0H 0C0,ALBERTA,CANADA; UNIV ALBERTA,DEPT SOIL SCI,EDMONTON,ALBERTA,CANADA",,,,,,,,19,84,84,0,17,AGR INST CANADA,OTTAWA,"SUITE 907 151 SLATER ST, OTTAWA ON K1P 5H4, CANADA",Aug-71,,,CAN J SOIL SCI,Can. J. Soil Sci.,,1977,57,2,,,,,197,203,,10.4141/cjss77-024,,,7,Soil Science,Agriculture,DF821,WOS:A1977DF82100013,,,,,10/31/19J,"ILOBA, C",,,,"ILOBA, C",,,EFFECT OF TRIFLURALIN ON FORMATION OF ECTOTROPHIC MYCORRHIZAE IN SOME PINE SPECIES .1. TOXICITY TO MYCORRHIZA FORMING FUNGI,EUROPEAN JOURNAL OF FOREST PATHOLOGY,,,English,Article,,,,,,,,,"UNIV NIGERIA,DEPT CROP SCI,NSUKKA,NIGERIA",,,,,,,,0,10,10,0,0,BLACKWELL WISSENSCHAFTS-VERLAG GMBH,BERLIN,"KURFURSTENDAMM 57, D-10707 BERLIN, GERMANY",0300-1237,,,EUR J FOREST PATHOL,Eur. J. Forest Pathol.,,1977,7,1,,,,,47,51,,,,,5,Forestry,Forestry,CX812,WOS:A1977CX81200006,,,,,10/31/19